{
  "schema_version": "1.0",
  "package_id": "confirmed-test-fixture",
  "rule_version": "fixture-v1",
  "rules_file": "rules.yaml",
  "rules_sha256": "e1fd11a76713c6b24b44542e51b434c4fc37fa7122f86bf9effb9768890bd49a",
  "source": "synthetic test fixture",
  "applicable_scope": "test only",
  "customer_confirmation_status": "confirmed",
  "released_at": "2026-07-16T00:00:00+08:00",
  "module_version": "0.1.1"
}
